{
  "abstractions": [
    {
      "index": 0,
      "ledger": [
        "abs-go-heap"
      ],
      "text": "Go heap: a list of backing arrays (byte values as Nat). A slice is (backing, offset, len, cap); append writes in place when len + k <= cap, else allocates a new backing array."
    },
    {
      "index": 1,
      "ledger": [
        "oracle-go-sizeclass-trunc512"
      ],
      "text": "Oracle (Go 1.24 runtime, runtime/slice.go nextslicecap + roundupsize for noscan byte slices): new capacity = smallest size class >= nextslicecap(newLen, oldCap). The class table (runtime/sizeclasses.go class_to_size) is in the state, truncated to classes <= 512 bytes: larger allocations are out of scope (the model then uses the exact requested capacity, which is wrong for real Go). The search policy keeps every slice below 512 bytes."
    },
    {
      "index": 2,
      "ledger": [
        "abs-newbatchdata-cap0"
      ],
      "text": "NewBatchData's make([]byte, 0) slices have capacity 0 and no backing array (backing index 0 is never written while cap = 0)."
    },
    {
      "index": 3,
      "ledger": [
        "scope-batchdata-unmodelled"
      ],
      "text": "l1TxHashes, blockNum and l1TxNum are not modelled (no aliasing relevant to TxsPayloadV2)."
    }
  ],
  "base_types": {
    "Arr": {
      "doc": "a backing array",
      "fields": [
        [
          "cells",
          "List<Nat>"
        ]
      ],
      "ghost": [],
      "kind": "record"
    },
    "Sl": {
      "doc": "Go slice header",
      "fields": [
        [
          "b",
          "Nat"
        ],
        [
          "off",
          "Nat"
        ],
        [
          "len",
          "Nat"
        ],
        [
          "cap",
          "Nat"
        ]
      ],
      "ghost": [],
      "kind": "record"
    }
  },
  "carriers": [
    {
      "base_type": "Act",
      "cls": "rep",
      "doc": "the actions' inputs: everything any principal can submit (R^ext is the full input type)",
      "id": "Act",
      "interface": true,
      "reach": "external",
      "sort_ref": null,
      "variants": {
        "append": [
          [
            "bctx",
            "List<Nat>"
          ],
          [
            "payload",
            "List<Nat>"
          ]
        ],
        "txsPayloadV2": []
      }
    },
    {
      "base_type": "Obs",
      "cls": "rep",
      "doc": "observations: the outcome every step logs (O_Ok, or O_Rev with the failed guard's reason) and the observers' values",
      "id": "Obs",
      "interface": false,
      "reach": "image",
      "revert_variants": [],
      "sort_ref": null
    },
    {
      "base_type": "State",
      "cls": "state",
      "id": "State",
      "initial": {
        "doc": "NewBatchData() (batch_data.go:23-29)",
        "pointer": "#/initial",
        "sets": [
          "classes",
          "ctx",
          "heap",
          "live",
          "log",
          "snap",
          "txp",
          "view"
        ]
      },
      "interface": false,
      "product": [
        "heap",
        "ctx",
        "txp",
        "view",
        "snap",
        "live",
        "classes",
        "log"
      ],
      "reach": "inductive",
      "sort_ref": null
    },
    {
      "base_type": "List<Nat>",
      "cls": "state",
      "component_of": "State",
      "doc": "oracle: Go runtime size classes",
      "ghost": false,
      "id": "classes",
      "interface": false,
      "key_space": "position",
      "reach": "inductive",
      "sort_ref": null
    },
    {
      "base_type": "Sl",
      "cls": "state",
      "component_of": "State",
      "doc": "BatchData.blockContexts",
      "ghost": false,
      "id": "ctx",
      "interface": false,
      "key_space": null,
      "reach": "inductive",
      "sort_ref": null
    },
    {
      "base_type": "List<Arr>",
      "cls": "state",
      "component_of": "State",
      "doc": "Go heap (backing arrays)",
      "ghost": false,
      "id": "heap",
      "interface": false,
      "key_space": "position",
      "reach": "inductive",
      "sort_ref": null
    },
    {
      "base_type": "Bool",
      "cls": "state",
      "component_of": "State",
      "doc": "GHOST: a caller holds the view",
      "ghost": true,
      "id": "live",
      "interface": false,
      "key_space": null,
      "reach": "inductive",
      "sort_ref": null
    },
    {
      "base_type": "List<Obs>",
      "cls": "state",
      "component_of": "State",
      "doc": "observations",
      "ghost": false,
      "id": "log",
      "interface": false,
      "key_space": "position",
      "reach": "inductive",
      "sort_ref": null
    },
    {
      "base_type": "List<Nat>",
      "cls": "state",
      "component_of": "State",
      "doc": "GHOST: contents of the view when it was returned",
      "ghost": true,
      "id": "snap",
      "interface": false,
      "key_space": "position",
      "reach": "inductive",
      "sort_ref": null
    },
    {
      "base_type": "Sl",
      "cls": "state",
      "component_of": "State",
      "doc": "BatchData.txsPayload",
      "ghost": false,
      "id": "txp",
      "interface": false,
      "key_space": null,
      "reach": "inductive",
      "sort_ref": null
    },
    {
      "base_type": "Sl",
      "cls": "state",
      "component_of": "State",
      "doc": "the slice the last TxsPayloadV2 call returned",
      "ghost": false,
      "id": "view",
      "interface": false,
      "key_space": null,
      "reach": "inductive",
      "sort_ref": null
    }
  ],
  "coverage": {
    "modelled": [
      "NewBatchData",
      "Append (blockContexts, txsPayload)",
      "TxsPayloadV2"
    ]
  },
  "coverage_debt": [
    {
      "kind": "ACCESS",
      "what": "library builtin go_append_heap declares no access kind: every state field passed to it is accessed whole (*)"
    },
    {
      "kind": "ACCESS",
      "what": "library builtin go_append_slice declares no access kind: every state field passed to it is accessed whole (*)"
    },
    {
      "kind": "ACCESS",
      "what": "library builtin go_read declares no access kind: every state field passed to it is accessed whole (*)"
    },
    {
      "kind": "UNMODELLED",
      "source": "#/coverage/debt/0",
      "what": "Append l1TxHashes / counters"
    },
    {
      "kind": "UNMODELLED",
      "source": "#/coverage/debt/1",
      "what": "Encode"
    },
    {
      "kind": "UNMODELLED",
      "source": "#/coverage/debt/2",
      "what": "DataHash"
    },
    {
      "kind": "UNMODELLED",
      "source": "#/coverage/debt/3",
      "what": "DataHashV2"
    },
    {
      "kind": "UNMODELLED",
      "source": "#/coverage/debt/4",
      "what": "EstimateCompressedSizeWithNewPayload"
    },
    {
      "kind": "UNMODELLED",
      "source": "#/coverage/debt/5",
      "what": "combinePayloads"
    }
  ],
  "defs": {},
  "diagram_version": "holon-diagram/0.1",
  "edges": [
    {
      "access": {
        "reads": [
          [
            "classes",
            "*"
          ]
        ],
        "writes": []
      },
      "component": "classes",
      "env": false,
      "id": "LOAD.classes",
      "kind": "LOAD",
      "model_fn": null,
      "partial": false,
      "principal_class": null,
      "pseudo": false,
      "readers": [
        "TRANS.append",
        "TRANS.txsPayloadV2"
      ],
      "src": "classes",
      "tgt": "State",
      "version": null
    },
    {
      "access": {
        "reads": [
          [
            "ctx",
            "*"
          ]
        ],
        "writes": []
      },
      "component": "ctx",
      "env": false,
      "id": "LOAD.ctx",
      "kind": "LOAD",
      "model_fn": null,
      "partial": false,
      "principal_class": null,
      "pseudo": false,
      "readers": [
        "TRANS.append",
        "TRANS.txsPayloadV2"
      ],
      "src": "ctx",
      "tgt": "State",
      "version": null
    },
    {
      "access": {
        "reads": [
          [
            "heap",
            "*"
          ]
        ],
        "writes": []
      },
      "component": "heap",
      "env": false,
      "id": "LOAD.heap",
      "kind": "LOAD",
      "model_fn": null,
      "partial": false,
      "principal_class": null,
      "pseudo": false,
      "readers": [
        "LOAD.obs.view_intact",
        "TRANS.append",
        "TRANS.txsPayloadV2"
      ],
      "src": "heap",
      "tgt": "State",
      "version": null
    },
    {
      "access": {
        "reads": [
          [
            "live",
            "*"
          ]
        ],
        "writes": []
      },
      "component": "live",
      "env": false,
      "id": "LOAD.live",
      "kind": "LOAD",
      "model_fn": null,
      "partial": false,
      "principal_class": null,
      "pseudo": false,
      "readers": [
        "LOAD.obs.view_intact"
      ],
      "src": "live",
      "tgt": "State",
      "version": null
    },
    {
      "access": {
        "reads": [],
        "writes": []
      },
      "component": "log",
      "env": false,
      "id": "LOAD.log",
      "kind": "LOAD",
      "model_fn": null,
      "partial": false,
      "principal_class": null,
      "pseudo": false,
      "readers": [],
      "src": "log",
      "tgt": "State",
      "version": null
    },
    {
      "access": {
        "reads": [
          [
            "heap",
            "*"
          ],
          [
            "live",
            "*"
          ],
          [
            "snap",
            "*"
          ],
          [
            "view",
            "*"
          ]
        ],
        "writes": []
      },
      "body": "!live||eq_nats(go_read(heap,view),snap)",
      "component": "view_intact",
      "defs": [],
      "doc": "OWN-alias: while a caller holds the view, its contents are unchanged by writes not made through it",
      "env": false,
      "id": "LOAD.obs.view_intact",
      "kind": "LOAD",
      "model_fn": "view_intact",
      "observer": true,
      "partial": false,